{
  "dataset_class": "PUBLIC_KB",
  "product_key": "kb-seller-loan",
  "source_url": "https://zloan.kbstar.com/quics?page=C108424",
  "snapshot_storage": "LOCAL_PRIVATE",
  "snapshot_object_key": "public-kb/sha256/def6b5b670fc0adf36909ffd1ce47bd416a67e213f7127b5058c44681fe7e44b.html",
  "content_type": "text/html",
  "byte_size": 124137,
  "snapshot_hash": "sha256:def6b5b670fc0adf36909ffd1ce47bd416a67e213f7127b5058c44681fe7e44b",
  "synthetic": false
}
