{
  "dataset_class": "PUBLIC_KB",
  "product_key": "small-business-credit",
  "source_url": "https://zloan.kbstar.com/quics?CooperCD=A000092&page=C106666",
  "snapshot_storage": "LOCAL_PRIVATE",
  "snapshot_object_key": "public-kb/sha256/08d48f15e16d98ce8db9e6d399defd12cbb47bc673243666f34bc386cb701c90.html",
  "content_type": "text/html",
  "byte_size": 90223,
  "snapshot_hash": "sha256:08d48f15e16d98ce8db9e6d399defd12cbb47bc673243666f34bc386cb701c90",
  "synthetic": false
}
